No.     Time           Source                Destination           Protocol Length Info
     98 49.302690      172.20.10.3           128.119.245.12        HTTP     646    GET /wireshark-labs/HTTP-wireshark-file4.html HTTP/1.1 

Frame 98: 646 bytes on wire (5168 bits), 646 bytes captured (5168 bits) on interface 0
    Interface id: 0 (\Device\NPF_{0EFDA7CA-9D7C-4454-837D-8FCD810B1695})
        Interface name: \Device\NPF_{0EFDA7CA-9D7C-4454-837D-8FCD810B1695}
        Interface description: \320\221\320\265\321\201\320\277\321\200\320\276\320\262\320\276\320\264\320\275\320\260\321\217 \321\201\320\265\321\202\321\214
    Encapsulation type: Ethernet (1)
    Arrival Time: Oct 19, 2019 11:40:21.806803000 Финляндия (лето)
    [Time shift for this packet: 0.000000000 seconds]
    Epoch Time: 1571474421.806803000 seconds
    [Time delta from previous captured frame: 0.001368000 seconds]
    [Time delta from previous displayed frame: 0.000000000 seconds]
    [Time since reference or first frame: 49.302690000 seconds]
    Frame Number: 98
    Frame Length: 646 bytes (5168 bits)
    Capture Length: 646 bytes (5168 bits)
    [Frame is marked: False]
    [Frame is ignored: False]
    [Protocols in frame: eth:ethertype:ip:tcp:http]
    [Coloring Rule Name: HTTP]
    [Coloring Rule String: http || tcp.port == 80 || http2]
Ethernet II, Src: ChiconyE_13:e5:8f (b0:c0:90:13:e5:8f), Dst: 6a:43:7c:7b:33:64 (6a:43:7c:7b:33:64)
    Destination: 6a:43:7c:7b:33:64 (6a:43:7c:7b:33:64)
        Address: 6a:43:7c:7b:33:64 (6a:43:7c:7b:33:64)
        .... ..1. .... .... .... .... = LG bit: Locally administered address (this is NOT the factory default)
        .... ...0 .... .... .... .... = IG bit: Individual address (unicast)
    Source: ChiconyE_13:e5:8f (b0:c0:90:13:e5:8f)
        Address: ChiconyE_13:e5:8f (b0:c0:90:13:e5:8f)
        .... ..0. .... .... .... .... = LG bit: Globally unique address (factory default)
        .... ...0 .... .... .... .... = IG bit: Individual address (unicast)
    Type: IPv4 (0x0800)
Internet Protocol Version 4, Src: 172.20.10.3, Dst: 128.119.245.12
    0100 .... = Version: 4
    .... 0101 = Header Length: 20 bytes (5)
    Differentiated Services Field: 0x00 (DSCP: CS0, ECN: Not-ECT)
        0000 00.. = Differentiated Services Codepoint: Default (0)
        .... ..00 = Explicit Congestion Notification: Not ECN-Capable Transport (0)
    Total Length: 632
    Identification: 0x892f (35119)
    Flags: 0x4000, Don't fragment
        0... .... .... .... = Reserved bit: Not set
        .1.. .... .... .... = Don't fragment: Set
        ..0. .... .... .... = More fragments: Not set
        ...0 0000 0000 0000 = Fragment offset: 0
    Time to live: 128
    Protocol: TCP (6)
    Header checksum: 0x43b5 [validation disabled]
    [Header checksum status: Unverified]
    Source: 172.20.10.3
    Destination: 128.119.245.12
Transmission Control Protocol, Src Port: 51966, Dst Port: 80, Seq: 1, Ack: 1, Len: 592
    Source Port: 51966
    Destination Port: 80
    [Stream index: 6]
    [TCP Segment Len: 592]
    Sequence number: 1    (relative sequence number)
    [Next sequence number: 593    (relative sequence number)]
    Acknowledgment number: 1    (relative ack number)
    0101 .... = Header Length: 20 bytes (5)
    Flags: 0x018 (PSH, ACK)
        000. .... .... = Reserved: Not set
        ...0 .... .... = Nonce: Not set
        .... 0... .... = Congestion Window Reduced (CWR): Not set
        .... .0.. .... = ECN-Echo: Not set
        .... ..0. .... = Urgent: Not set
        .... ...1 .... = Acknowledgment: Set
        .... .... 1... = Push: Set
        .... .... .0.. = Reset: Not set
        .... .... ..0. = Syn: Not set
        .... .... ...0 = Fin: Not set
        [TCP Flags: ·······AP···]
    Window size value: 514
    [Calculated window size: 131584]
    [Window size scaling factor: 256]
    Checksum: 0x55e8 [unverified]
    [Checksum Status: Unverified]
    Urgent pointer: 0
    [SEQ/ACK analysis]
        [iRTT: 0.158214000 seconds]
        [Bytes in flight: 592]
        [Bytes sent since last PSH flag: 592]
    [Timestamps]
        [Time since first frame in this TCP stream: 0.159582000 seconds]
        [Time since previous frame in this TCP stream: 0.001368000 seconds]
    TCP payload (592 bytes)
Hypertext Transfer Protocol
    GET /wireshark-labs/HTTP-wireshark-file4.html HTTP/1.1\r\n
    Host: gaia.cs.umass.edu\r\n
    Connection: keep-alive\r\n
    Cache-Control: max-age=0\r\n
    Upgrade-Insecure-Requests: 1\r\n
    User-Agent: Mozilla/5.0 (Windows NT 10.0; Win64; x64) AppleWebKit/537.36 (KHTML, like Gecko) Chrome/77.0.3865.120 Safari/537.36\r\n
    Accept: text/html,application/xhtml+xml,application/xml;q=0.9,image/webp,image/apng,*/*;q=0.8,application/signed-exchange;v=b3\r\n
    Accept-Encoding: gzip, deflate\r\n
    Accept-Language: ru-RU,ru;q=0.9,en-US;q=0.8,en;q=0.7\r\n
    If-None-Match: "2ca-5953d25d1970b"\r\n
    If-Modified-Since: Sat, 19 Oct 2019 05:59:03 GMT\r\n
    \r\n
    [Full request URI: http://gaia.cs.umass.edu/wireshark-labs/HTTP-wireshark-file4.html]
    [HTTP request 1/2]
    [Response in frame: 100]
    [Next request in frame: 102]

No.     Time           Source                Destination           Protocol Length Info
    100 49.467714      128.119.245.12        172.20.10.3           HTTP     294    HTTP/1.1 304 Not Modified 

Frame 100: 294 bytes on wire (2352 bits), 294 bytes captured (2352 bits) on interface 0
    Interface id: 0 (\Device\NPF_{0EFDA7CA-9D7C-4454-837D-8FCD810B1695})
        Interface name: \Device\NPF_{0EFDA7CA-9D7C-4454-837D-8FCD810B1695}
        Interface description: \320\221\320\265\321\201\320\277\321\200\320\276\320\262\320\276\320\264\320\275\320\260\321\217 \321\201\320\265\321\202\321\214
    Encapsulation type: Ethernet (1)
    Arrival Time: Oct 19, 2019 11:40:21.971827000 Финляндия (лето)
    [Time shift for this packet: 0.000000000 seconds]
    Epoch Time: 1571474421.971827000 seconds
    [Time delta from previous captured frame: 0.000003000 seconds]
    [Time delta from previous displayed frame: 0.165024000 seconds]
    [Time since reference or first frame: 49.467714000 seconds]
    Frame Number: 100
    Frame Length: 294 bytes (2352 bits)
    Capture Length: 294 bytes (2352 bits)
    [Frame is marked: False]
    [Frame is ignored: False]
    [Protocols in frame: eth:ethertype:ip:tcp:http]
    [Coloring Rule Name: HTTP]
    [Coloring Rule String: http || tcp.port == 80 || http2]
Ethernet II, Src: 6a:43:7c:7b:33:64 (6a:43:7c:7b:33:64), Dst: ChiconyE_13:e5:8f (b0:c0:90:13:e5:8f)
    Destination: ChiconyE_13:e5:8f (b0:c0:90:13:e5:8f)
        Address: ChiconyE_13:e5:8f (b0:c0:90:13:e5:8f)
        .... ..0. .... .... .... .... = LG bit: Globally unique address (factory default)
        .... ...0 .... .... .... .... = IG bit: Individual address (unicast)
    Source: 6a:43:7c:7b:33:64 (6a:43:7c:7b:33:64)
        Address: 6a:43:7c:7b:33:64 (6a:43:7c:7b:33:64)
        .... ..1. .... .... .... .... = LG bit: Locally administered address (this is NOT the factory default)
        .... ...0 .... .... .... .... = IG bit: Individual address (unicast)
    Type: IPv4 (0x0800)
Internet Protocol Version 4, Src: 128.119.245.12, Dst: 172.20.10.3
    0100 .... = Version: 4
    .... 0101 = Header Length: 20 bytes (5)
    Differentiated Services Field: 0x00 (DSCP: CS0, ECN: Not-ECT)
        0000 00.. = Differentiated Services Codepoint: Default (0)
        .... ..00 = Explicit Congestion Notification: Not ECN-Capable Transport (0)
    Total Length: 280
    Identification: 0x23a0 (9120)
    Flags: 0x0000
        0... .... .... .... = Reserved bit: Not set
        .0.. .... .... .... = Don't fragment: Not set
        ..0. .... .... .... = More fragments: Not set
        ...0 0000 0000 0000 = Fragment offset: 0
    Time to live: 43
    Protocol: TCP (6)
    Header checksum: 0x3fa5 [validation disabled]
    [Header checksum status: Unverified]
    Source: 128.119.245.12
    Destination: 172.20.10.3
Transmission Control Protocol, Src Port: 80, Dst Port: 51966, Seq: 1, Ack: 593, Len: 240
    Source Port: 80
    Destination Port: 51966
    [Stream index: 6]
    [TCP Segment Len: 240]
    Sequence number: 1    (relative sequence number)
    [Next sequence number: 241    (relative sequence number)]
    Acknowledgment number: 593    (relative ack number)
    0101 .... = Header Length: 20 bytes (5)
    Flags: 0x018 (PSH, ACK)
        000. .... .... = Reserved: Not set
        ...0 .... .... = Nonce: Not set
        .... 0... .... = Congestion Window Reduced (CWR): Not set
        .... .0.. .... = ECN-Echo: Not set
        .... ..0. .... = Urgent: Not set
        .... ...1 .... = Acknowledgment: Set
        .... .... 1... = Push: Set
        .... .... .0.. = Reset: Not set
        .... .... ..0. = Syn: Not set
        .... .... ...0 = Fin: Not set
        [TCP Flags: ·······AP···]
    Window size value: 238
    [Calculated window size: 30464]
    [Window size scaling factor: 128]
    Checksum: 0x158e [unverified]
    [Checksum Status: Unverified]
    Urgent pointer: 0
    [SEQ/ACK analysis]
        [iRTT: 0.158214000 seconds]
        [Bytes in flight: 240]
        [Bytes sent since last PSH flag: 240]
    [Timestamps]
        [Time since first frame in this TCP stream: 0.324606000 seconds]
        [Time since previous frame in this TCP stream: 0.000003000 seconds]
    TCP payload (240 bytes)
Hypertext Transfer Protocol
    HTTP/1.1 304 Not Modified\r\n
    Date: Sat, 19 Oct 2019 08:40:20 GMT\r\n
    Server: Apache/2.4.6 (CentOS) OpenSSL/1.0.2k-fips PHP/5.4.16 mod_perl/2.0.10 Perl/v5.16.3\r\n
    Connection: Keep-Alive\r\n
    Keep-Alive: timeout=5, max=100\r\n
    ETag: "2ca-5953d25d1970b"\r\n
    \r\n
    [HTTP response 1/2]
    [Time since request: 0.165024000 seconds]
    [Request in frame: 98]
    [Next request in frame: 102]
    [Next response in frame: 103]
    [Request URI: http://gaia.cs.umass.edu/wireshark-labs/HTTP-wireshark-file4.html]

No.     Time           Source                Destination           Protocol Length Info
    102 49.848106      172.20.10.3           128.119.245.12        HTTP     515    GET /favicon.ico HTTP/1.1 

Frame 102: 515 bytes on wire (4120 bits), 515 bytes captured (4120 bits) on interface 0
    Interface id: 0 (\Device\NPF_{0EFDA7CA-9D7C-4454-837D-8FCD810B1695})
        Interface name: \Device\NPF_{0EFDA7CA-9D7C-4454-837D-8FCD810B1695}
        Interface description: \320\221\320\265\321\201\320\277\321\200\320\276\320\262\320\276\320\264\320\275\320\260\321\217 \321\201\320\265\321\202\321\214
    Encapsulation type: Ethernet (1)
    Arrival Time: Oct 19, 2019 11:40:22.352219000 Финляндия (лето)
    [Time shift for this packet: 0.000000000 seconds]
    Epoch Time: 1571474422.352219000 seconds
    [Time delta from previous captured frame: 0.338244000 seconds]
    [Time delta from previous displayed frame: 0.380392000 seconds]
    [Time since reference or first frame: 49.848106000 seconds]
    Frame Number: 102
    Frame Length: 515 bytes (4120 bits)
    Capture Length: 515 bytes (4120 bits)
    [Frame is marked: False]
    [Frame is ignored: False]
    [Protocols in frame: eth:ethertype:ip:tcp:http]
    [Coloring Rule Name: HTTP]
    [Coloring Rule String: http || tcp.port == 80 || http2]
Ethernet II, Src: ChiconyE_13:e5:8f (b0:c0:90:13:e5:8f), Dst: 6a:43:7c:7b:33:64 (6a:43:7c:7b:33:64)
    Destination: 6a:43:7c:7b:33:64 (6a:43:7c:7b:33:64)
        Address: 6a:43:7c:7b:33:64 (6a:43:7c:7b:33:64)
        .... ..1. .... .... .... .... = LG bit: Locally administered address (this is NOT the factory default)
        .... ...0 .... .... .... .... = IG bit: Individual address (unicast)
    Source: ChiconyE_13:e5:8f (b0:c0:90:13:e5:8f)
        Address: ChiconyE_13:e5:8f (b0:c0:90:13:e5:8f)
        .... ..0. .... .... .... .... = LG bit: Globally unique address (factory default)
        .... ...0 .... .... .... .... = IG bit: Individual address (unicast)
    Type: IPv4 (0x0800)
Internet Protocol Version 4, Src: 172.20.10.3, Dst: 128.119.245.12
    0100 .... = Version: 4
    .... 0101 = Header Length: 20 bytes (5)
    Differentiated Services Field: 0x00 (DSCP: CS0, ECN: Not-ECT)
        0000 00.. = Differentiated Services Codepoint: Default (0)
        .... ..00 = Explicit Congestion Notification: Not ECN-Capable Transport (0)
    Total Length: 501
    Identification: 0x8931 (35121)
    Flags: 0x4000, Don't fragment
        0... .... .... .... = Reserved bit: Not set
        .1.. .... .... .... = Don't fragment: Set
        ..0. .... .... .... = More fragments: Not set
        ...0 0000 0000 0000 = Fragment offset: 0
    Time to live: 128
    Protocol: TCP (6)
    Header checksum: 0x4436 [validation disabled]
    [Header checksum status: Unverified]
    Source: 172.20.10.3
    Destination: 128.119.245.12
Transmission Control Protocol, Src Port: 51966, Dst Port: 80, Seq: 593, Ack: 241, Len: 461
    Source Port: 51966
    Destination Port: 80
    [Stream index: 6]
    [TCP Segment Len: 461]
    Sequence number: 593    (relative sequence number)
    [Next sequence number: 1054    (relative sequence number)]
    Acknowledgment number: 241    (relative ack number)
    0101 .... = Header Length: 20 bytes (5)
    Flags: 0x018 (PSH, ACK)
        000. .... .... = Reserved: Not set
        ...0 .... .... = Nonce: Not set
        .... 0... .... = Congestion Window Reduced (CWR): Not set
        .... .0.. .... = ECN-Echo: Not set
        .... ..0. .... = Urgent: Not set
        .... ...1 .... = Acknowledgment: Set
        .... .... 1... = Push: Set
        .... .... .0.. = Reset: Not set
        .... .... ..0. = Syn: Not set
        .... .... ...0 = Fin: Not set
        [TCP Flags: ·······AP···]
    Window size value: 513
    [Calculated window size: 131328]
    [Window size scaling factor: 256]
    Checksum: 0x43a6 [unverified]
    [Checksum Status: Unverified]
    Urgent pointer: 0
    [SEQ/ACK analysis]
        [iRTT: 0.158214000 seconds]
        [Bytes in flight: 461]
        [Bytes sent since last PSH flag: 461]
    [Timestamps]
        [Time since first frame in this TCP stream: 0.704998000 seconds]
        [Time since previous frame in this TCP stream: 0.338244000 seconds]
    TCP payload (461 bytes)
Hypertext Transfer Protocol
    GET /favicon.ico HTTP/1.1\r\n
    Host: gaia.cs.umass.edu\r\n
    Connection: keep-alive\r\n
    Pragma: no-cache\r\n
    Cache-Control: no-cache\r\n
    User-Agent: Mozilla/5.0 (Windows NT 10.0; Win64; x64) AppleWebKit/537.36 (KHTML, like Gecko) Chrome/77.0.3865.120 Safari/537.36\r\n
    Accept: image/webp,image/apng,image/*,*/*;q=0.8\r\n
    Referer: http://gaia.cs.umass.edu/wireshark-labs/HTTP-wireshark-file4.html\r\n
    Accept-Encoding: gzip, deflate\r\n
    Accept-Language: ru-RU,ru;q=0.9,en-US;q=0.8,en;q=0.7\r\n
    \r\n
    [Full request URI: http://gaia.cs.umass.edu/favicon.ico]
    [HTTP request 2/2]
    [Prev request in frame: 98]
    [Response in frame: 103]

No.     Time           Source                Destination           Protocol Length Info
    103 50.043670      128.119.245.12        172.20.10.3           HTTP     559    HTTP/1.1 302 Found  (text/html)

Frame 103: 559 bytes on wire (4472 bits), 559 bytes captured (4472 bits) on interface 0
    Interface id: 0 (\Device\NPF_{0EFDA7CA-9D7C-4454-837D-8FCD810B1695})
        Interface name: \Device\NPF_{0EFDA7CA-9D7C-4454-837D-8FCD810B1695}
        Interface description: \320\221\320\265\321\201\320\277\321\200\320\276\320\262\320\276\320\264\320\275\320\260\321\217 \321\201\320\265\321\202\321\214
    Encapsulation type: Ethernet (1)
    Arrival Time: Oct 19, 2019 11:40:22.547783000 Финляндия (лето)
    [Time shift for this packet: 0.000000000 seconds]
    Epoch Time: 1571474422.547783000 seconds
    [Time delta from previous captured frame: 0.195564000 seconds]
    [Time delta from previous displayed frame: 0.195564000 seconds]
    [Time since reference or first frame: 50.043670000 seconds]
    Frame Number: 103
    Frame Length: 559 bytes (4472 bits)
    Capture Length: 559 bytes (4472 bits)
    [Frame is marked: False]
    [Frame is ignored: False]
    [Protocols in frame: eth:ethertype:ip:tcp:http:data-text-lines]
    [Coloring Rule Name: HTTP]
    [Coloring Rule String: http || tcp.port == 80 || http2]
Ethernet II, Src: 6a:43:7c:7b:33:64 (6a:43:7c:7b:33:64), Dst: ChiconyE_13:e5:8f (b0:c0:90:13:e5:8f)
    Destination: ChiconyE_13:e5:8f (b0:c0:90:13:e5:8f)
        Address: ChiconyE_13:e5:8f (b0:c0:90:13:e5:8f)
        .... ..0. .... .... .... .... = LG bit: Globally unique address (factory default)
        .... ...0 .... .... .... .... = IG bit: Individual address (unicast)
    Source: 6a:43:7c:7b:33:64 (6a:43:7c:7b:33:64)
        Address: 6a:43:7c:7b:33:64 (6a:43:7c:7b:33:64)
        .... ..1. .... .... .... .... = LG bit: Locally administered address (this is NOT the factory default)
        .... ...0 .... .... .... .... = IG bit: Individual address (unicast)
    Type: IPv4 (0x0800)
Internet Protocol Version 4, Src: 128.119.245.12, Dst: 172.20.10.3
    0100 .... = Version: 4
    .... 0101 = Header Length: 20 bytes (5)
    Differentiated Services Field: 0x00 (DSCP: CS0, ECN: Not-ECT)
        0000 00.. = Differentiated Services Codepoint: Default (0)
        .... ..00 = Explicit Congestion Notification: Not ECN-Capable Transport (0)
    Total Length: 545
    Identification: 0x23a1 (9121)
    Flags: 0x0000
        0... .... .... .... = Reserved bit: Not set
        .0.. .... .... .... = Don't fragment: Not set
        ..0. .... .... .... = More fragments: Not set
        ...0 0000 0000 0000 = Fragment offset: 0
    Time to live: 43
    Protocol: TCP (6)
    Header checksum: 0x3e9b [validation disabled]
    [Header checksum status: Unverified]
    Source: 128.119.245.12
    Destination: 172.20.10.3
Transmission Control Protocol, Src Port: 80, Dst Port: 51966, Seq: 241, Ack: 1054, Len: 505
    Source Port: 80
    Destination Port: 51966
    [Stream index: 6]
    [TCP Segment Len: 505]
    Sequence number: 241    (relative sequence number)
    [Next sequence number: 747    (relative sequence number)]
    Acknowledgment number: 1054    (relative ack number)
    0101 .... = Header Length: 20 bytes (5)
    Flags: 0x019 (FIN, PSH, ACK)
        000. .... .... = Reserved: Not set
        ...0 .... .... = Nonce: Not set
        .... 0... .... = Congestion Window Reduced (CWR): Not set
        .... .0.. .... = ECN-Echo: Not set
        .... ..0. .... = Urgent: Not set
        .... ...1 .... = Acknowledgment: Set
        .... .... 1... = Push: Set
        .... .... .0.. = Reset: Not set
        .... .... ..0. = Syn: Not set
        .... .... ...1 = Fin: Set
        [TCP Flags: ·······AP··F]
    Window size value: 247
    [Calculated window size: 31616]
    [Window size scaling factor: 128]
    Checksum: 0x9789 [unverified]
    [Checksum Status: Unverified]
    Urgent pointer: 0
    [SEQ/ACK analysis]
        [This is an ACK to the segment in frame: 102]
        [The RTT to ACK the segment was: 0.195564000 seconds]
        [iRTT: 0.158214000 seconds]
        [Bytes in flight: 506]
        [Bytes sent since last PSH flag: 505]
    [Timestamps]
        [Time since first frame in this TCP stream: 0.900562000 seconds]
        [Time since previous frame in this TCP stream: 0.195564000 seconds]
    TCP payload (505 bytes)
Hypertext Transfer Protocol
    HTTP/1.1 302 Found\r\n
    Content-Type: text/html; charset=UTF-8\r\n
    Content-Length: 248\r\n
        [Content length: 248]
    Location: http://lp.kyivstar.net/error.html?msisdn=380672244375&error-code=404&request-url1=http://gaia.cs.umass.edu/favicon.ico\r\n
    Cache-Control: no-cache\r\n
    Connection: Close\r\n
    \r\n
    [HTTP response 2/2]
    [Time since request: 0.195564000 seconds]
    [Prev request in frame: 98]
    [Prev response in frame: 100]
    [Request in frame: 102]
    [Request URI: http://gaia.cs.umass.edu/favicon.ico]
    File Data: 248 bytes
Line-based text data: text/html (1 lines)
     [truncated]<html><head><title>302 Found</title></head><body><h1>302 Found</h1><p>The document has moved <a href="http://lp.kyivstar.net/error.html?msisdn=380672244375&error-code=404&request-url1=http://gaia.cs.umass.edu/favicon.ico">here

No.     Time           Source                Destination           Protocol Length Info
    259 121.206084     23.8.10.249           172.20.10.3           HTTP/XML 343    [TCP ACKed unseen segment] HTTP/1.1 200 OK 

Frame 259: 343 bytes on wire (2744 bits), 343 bytes captured (2744 bits) on interface 0
    Interface id: 0 (\Device\NPF_{0EFDA7CA-9D7C-4454-837D-8FCD810B1695})
        Interface name: \Device\NPF_{0EFDA7CA-9D7C-4454-837D-8FCD810B1695}
        Interface description: \320\221\320\265\321\201\320\277\321\200\320\276\320\262\320\276\320\264\320\275\320\260\321\217 \321\201\320\265\321\202\321\214
    Encapsulation type: Ethernet (1)
    Arrival Time: Oct 19, 2019 11:41:33.710197000 Финляндия (лето)
    [Time shift for this packet: 0.000000000 seconds]
    Epoch Time: 1571474493.710197000 seconds
    [Time delta from previous captured frame: 0.000002000 seconds]
    [Time delta from previous displayed frame: 71.162414000 seconds]
    [Time since reference or first frame: 121.206084000 seconds]
    Frame Number: 259
    Frame Length: 343 bytes (2744 bits)
    Capture Length: 343 bytes (2744 bits)
    [Frame is marked: True]
    [Frame is ignored: False]
    [Protocols in frame: eth:ethertype:ip:tcp:http:xml]
    [Coloring Rule Name: Bad TCP]
    [Coloring Rule String: tcp.analysis.flags && !tcp.analysis.window_update]
Ethernet II, Src: 6a:43:7c:7b:33:64 (6a:43:7c:7b:33:64), Dst: ChiconyE_13:e5:8f (b0:c0:90:13:e5:8f)
    Destination: ChiconyE_13:e5:8f (b0:c0:90:13:e5:8f)
        Address: ChiconyE_13:e5:8f (b0:c0:90:13:e5:8f)
        .... ..0. .... .... .... .... = LG bit: Globally unique address (factory default)
        .... ...0 .... .... .... .... = IG bit: Individual address (unicast)
    Source: 6a:43:7c:7b:33:64 (6a:43:7c:7b:33:64)
        Address: 6a:43:7c:7b:33:64 (6a:43:7c:7b:33:64)
        .... ..1. .... .... .... .... = LG bit: Locally administered address (this is NOT the factory default)
        .... ...0 .... .... .... .... = IG bit: Individual address (unicast)
    Type: IPv4 (0x0800)
Internet Protocol Version 4, Src: 23.8.10.249, Dst: 172.20.10.3
    0100 .... = Version: 4
    .... 0101 = Header Length: 20 bytes (5)
    Differentiated Services Field: 0x00 (DSCP: CS0, ECN: Not-ECT)
        0000 00.. = Differentiated Services Codepoint: Default (0)
        .... ..00 = Explicit Congestion Notification: Not ECN-Capable Transport (0)
    Total Length: 329
    Identification: 0xfe17 (65047)
    Flags: 0x0000
        0... .... .... .... = Reserved bit: Not set
        .0.. .... .... .... = Don't fragment: Not set
        ..0. .... .... .... = More fragments: Not set
        ...0 0000 0000 0000 = Fragment offset: 0
    Time to live: 58
    Protocol: TCP (6)
    Header checksum: 0xa97f [validation disabled]
    [Header checksum status: Unverified]
    Source: 23.8.10.249
    Destination: 172.20.10.3
Transmission Control Protocol, Src Port: 80, Dst Port: 51970, Seq: 1401, Ack: 218, Len: 289
    Source Port: 80
    Destination Port: 51970
    [Stream index: 10]
    [TCP Segment Len: 289]
    Sequence number: 1401    (relative sequence number)
    [Next sequence number: 1690    (relative sequence number)]
    Acknowledgment number: 218    (relative ack number)
    0101 .... = Header Length: 20 bytes (5)
    Flags: 0x018 (PSH, ACK)
        000. .... .... = Reserved: Not set
        ...0 .... .... = Nonce: Not set
        .... 0... .... = Congestion Window Reduced (CWR): Not set
        .... .0.. .... = ECN-Echo: Not set
        .... ..0. .... = Urgent: Not set
        .... ...1 .... = Acknowledgment: Set
        .... .... 1... = Push: Set
        .... .... .0.. = Reset: Not set
        .... .... ..0. = Syn: Not set
        .... .... ...0 = Fin: Not set
        [TCP Flags: ·······AP···]
    Window size value: 237
    [Calculated window size: 30336]
    [Window size scaling factor: 128]
    Checksum: 0xe7a0 [unverified]
    [Checksum Status: Unverified]
    Urgent pointer: 0
    [SEQ/ACK analysis]
        [iRTT: 0.052274000 seconds]
        [Bytes in flight: 1689]
        [Bytes sent since last PSH flag: 1689]
        [TCP Analysis Flags]
    [Timestamps]
        [Time since first frame in this TCP stream: 0.109187000 seconds]
        [Time since previous frame in this TCP stream: 0.000002000 seconds]
    TCP payload (289 bytes)
    TCP segment data (289 bytes)
[2 Reassembled TCP Segments (1689 bytes): #258(1400), #259(289)]
Hypertext Transfer Protocol
    HTTP/1.1 200 OK\r\n
    Content-Type: text/xml; charset=utf-8\r\n
    ETag: "715690507"\r\n
    Server: Microsoft-IIS/8.5\r\n
    X-CS-DocVersions: |cms-amp-AAo37M|29|\r\n
    X-CMS-ExecutionTimeInMilliseconds: 0\r\n
    AppEx-Activity-Id: 95c5e218-4464-406a-b62b-b65ad6579a55\r\n
    X-Trace-Context: {"ActivityId":"95c5e218-4464-406a-b62b-b65ad6579a55"}\r\n
    X-AspNet-Version: 4.0.30319\r\n
    X-Powered-By: ASP.NET\r\n
    X-Diagnostic-S: Content_IN_19\r\n
    X-Diagnostic-DC: northeu\r\n
    Cache-Control: public, max-age=65\r\n
    Date: Sat, 19 Oct 2019 08:41:32 GMT\r\n
    Content-Length: 1152\r\n
        [Content length: 1152]
    Connection: keep-alive\r\n
    \r\n
    [HTTP response 1/1]
    File Data: 1152 bytes
eXtensible Markup Language

No.     Time           Source                Destination           Protocol Length Info
   1078 493.735439     172.20.10.3           128.119.245.12        HTTP     646    GET /wireshark-labs/HTTP-wireshark-file4.html HTTP/1.1 

Frame 1078: 646 bytes on wire (5168 bits), 646 bytes captured (5168 bits) on interface 0
    Interface id: 0 (\Device\NPF_{0EFDA7CA-9D7C-4454-837D-8FCD810B1695})
        Interface name: \Device\NPF_{0EFDA7CA-9D7C-4454-837D-8FCD810B1695}
        Interface description: \320\221\320\265\321\201\320\277\321\200\320\276\320\262\320\276\320\264\320\275\320\260\321\217 \321\201\320\265\321\202\321\214
    Encapsulation type: Ethernet (1)
    Arrival Time: Oct 19, 2019 11:47:46.239552000 Финляндия (лето)
    [Time shift for this packet: 0.000000000 seconds]
    Epoch Time: 1571474866.239552000 seconds
    [Time delta from previous captured frame: 0.001133000 seconds]
    [Time delta from previous displayed frame: 372.529355000 seconds]
    [Time since reference or first frame: 493.735439000 seconds]
    Frame Number: 1078
    Frame Length: 646 bytes (5168 bits)
    Capture Length: 646 bytes (5168 bits)
    [Frame is marked: False]
    [Frame is ignored: False]
    [Protocols in frame: eth:ethertype:ip:tcp:http]
    [Coloring Rule Name: HTTP]
    [Coloring Rule String: http || tcp.port == 80 || http2]
Ethernet II, Src: ChiconyE_13:e5:8f (b0:c0:90:13:e5:8f), Dst: 6a:43:7c:7b:33:64 (6a:43:7c:7b:33:64)
    Destination: 6a:43:7c:7b:33:64 (6a:43:7c:7b:33:64)
        Address: 6a:43:7c:7b:33:64 (6a:43:7c:7b:33:64)
        .... ..1. .... .... .... .... = LG bit: Locally administered address (this is NOT the factory default)
        .... ...0 .... .... .... .... = IG bit: Individual address (unicast)
    Source: ChiconyE_13:e5:8f (b0:c0:90:13:e5:8f)
        Address: ChiconyE_13:e5:8f (b0:c0:90:13:e5:8f)
        .... ..0. .... .... .... .... = LG bit: Globally unique address (factory default)
        .... ...0 .... .... .... .... = IG bit: Individual address (unicast)
    Type: IPv4 (0x0800)
Internet Protocol Version 4, Src: 172.20.10.3, Dst: 128.119.245.12
    0100 .... = Version: 4
    .... 0101 = Header Length: 20 bytes (5)
    Differentiated Services Field: 0x00 (DSCP: CS0, ECN: Not-ECT)
        0000 00.. = Differentiated Services Codepoint: Default (0)
        .... ..00 = Explicit Congestion Notification: Not ECN-Capable Transport (0)
    Total Length: 632
    Identification: 0x893a (35130)
    Flags: 0x4000, Don't fragment
        0... .... .... .... = Reserved bit: Not set
        .1.. .... .... .... = Don't fragment: Set
        ..0. .... .... .... = More fragments: Not set
        ...0 0000 0000 0000 = Fragment offset: 0
    Time to live: 128
    Protocol: TCP (6)
    Header checksum: 0x43aa [validation disabled]
    [Header checksum status: Unverified]
    Source: 172.20.10.3
    Destination: 128.119.245.12
Transmission Control Protocol, Src Port: 51974, Dst Port: 80, Seq: 1, Ack: 1, Len: 592
    Source Port: 51974
    Destination Port: 80
    [Stream index: 12]
    [TCP Segment Len: 592]
    Sequence number: 1    (relative sequence number)
    [Next sequence number: 593    (relative sequence number)]
    Acknowledgment number: 1    (relative ack number)
    0101 .... = Header Length: 20 bytes (5)
    Flags: 0x018 (PSH, ACK)
        000. .... .... = Reserved: Not set
        ...0 .... .... = Nonce: Not set
        .... 0... .... = Congestion Window Reduced (CWR): Not set
        .... .0.. .... = ECN-Echo: Not set
        .... ..0. .... = Urgent: Not set
        .... ...1 .... = Acknowledgment: Set
        .... .... 1... = Push: Set
        .... .... .0.. = Reset: Not set
        .... .... ..0. = Syn: Not set
        .... .... ...0 = Fin: Not set
        [TCP Flags: ·······AP···]
    Window size value: 514
    [Calculated window size: 131584]
    [Window size scaling factor: 256]
    Checksum: 0x39ae [unverified]
    [Checksum Status: Unverified]
    Urgent pointer: 0
    [SEQ/ACK analysis]
        [iRTT: 0.202892000 seconds]
        [Bytes in flight: 592]
        [Bytes sent since last PSH flag: 592]
    [Timestamps]
        [Time since first frame in this TCP stream: 0.204303000 seconds]
        [Time since previous frame in this TCP stream: 0.001411000 seconds]
    TCP payload (592 bytes)
Hypertext Transfer Protocol
    GET /wireshark-labs/HTTP-wireshark-file4.html HTTP/1.1\r\n
    Host: gaia.cs.umass.edu\r\n
    Connection: keep-alive\r\n
    Cache-Control: max-age=0\r\n
    Upgrade-Insecure-Requests: 1\r\n
    User-Agent: Mozilla/5.0 (Windows NT 10.0; Win64; x64) AppleWebKit/537.36 (KHTML, like Gecko) Chrome/77.0.3865.120 Safari/537.36\r\n
    Accept: text/html,application/xhtml+xml,application/xml;q=0.9,image/webp,image/apng,*/*;q=0.8,application/signed-exchange;v=b3\r\n
    Accept-Encoding: gzip, deflate\r\n
    Accept-Language: ru-RU,ru;q=0.9,en-US;q=0.8,en;q=0.7\r\n
    If-None-Match: "2ca-5953d25d1970b"\r\n
    If-Modified-Since: Sat, 19 Oct 2019 05:59:03 GMT\r\n
    \r\n
    [Full request URI: http://gaia.cs.umass.edu/wireshark-labs/HTTP-wireshark-file4.html]
    [HTTP request 1/2]
    [Response in frame: 1080]
    [Next request in frame: 1082]

No.     Time           Source                Destination           Protocol Length Info
   1080 493.895841     128.119.245.12        172.20.10.3           HTTP     294    HTTP/1.1 304 Not Modified 

Frame 1080: 294 bytes on wire (2352 bits), 294 bytes captured (2352 bits) on interface 0
    Interface id: 0 (\Device\NPF_{0EFDA7CA-9D7C-4454-837D-8FCD810B1695})
        Interface name: \Device\NPF_{0EFDA7CA-9D7C-4454-837D-8FCD810B1695}
        Interface description: \320\221\320\265\321\201\320\277\321\200\320\276\320\262\320\276\320\264\320\275\320\260\321\217 \321\201\320\265\321\202\321\214
    Encapsulation type: Ethernet (1)
    Arrival Time: Oct 19, 2019 11:47:46.399954000 Финляндия (лето)
    [Time shift for this packet: 0.000000000 seconds]
    Epoch Time: 1571474866.399954000 seconds
    [Time delta from previous captured frame: 0.005347000 seconds]
    [Time delta from previous displayed frame: 0.160402000 seconds]
    [Time since reference or first frame: 493.895841000 seconds]
    Frame Number: 1080
    Frame Length: 294 bytes (2352 bits)
    Capture Length: 294 bytes (2352 bits)
    [Frame is marked: False]
    [Frame is ignored: False]
    [Protocols in frame: eth:ethertype:ip:tcp:http]
    [Coloring Rule Name: HTTP]
    [Coloring Rule String: http || tcp.port == 80 || http2]
Ethernet II, Src: 6a:43:7c:7b:33:64 (6a:43:7c:7b:33:64), Dst: ChiconyE_13:e5:8f (b0:c0:90:13:e5:8f)
    Destination: ChiconyE_13:e5:8f (b0:c0:90:13:e5:8f)
        Address: ChiconyE_13:e5:8f (b0:c0:90:13:e5:8f)
        .... ..0. .... .... .... .... = LG bit: Globally unique address (factory default)
        .... ...0 .... .... .... .... = IG bit: Individual address (unicast)
    Source: 6a:43:7c:7b:33:64 (6a:43:7c:7b:33:64)
        Address: 6a:43:7c:7b:33:64 (6a:43:7c:7b:33:64)
        .... ..1. .... .... .... .... = LG bit: Locally administered address (this is NOT the factory default)
        .... ...0 .... .... .... .... = IG bit: Individual address (unicast)
    Type: IPv4 (0x0800)
Internet Protocol Version 4, Src: 128.119.245.12, Dst: 172.20.10.3
    0100 .... = Version: 4
    .... 0101 = Header Length: 20 bytes (5)
    Differentiated Services Field: 0x00 (DSCP: CS0, ECN: Not-ECT)
        0000 00.. = Differentiated Services Codepoint: Default (0)
        .... ..00 = Explicit Congestion Notification: Not ECN-Capable Transport (0)
    Total Length: 280
    Identification: 0x7268 (29288)
    Flags: 0x0000
        0... .... .... .... = Reserved bit: Not set
        .0.. .... .... .... = Don't fragment: Not set
        ..0. .... .... .... = More fragments: Not set
        ...0 0000 0000 0000 = Fragment offset: 0
    Time to live: 45
    Protocol: TCP (6)
    Header checksum: 0xeedc [validation disabled]
    [Header checksum status: Unverified]
    Source: 128.119.245.12
    Destination: 172.20.10.3
Transmission Control Protocol, Src Port: 80, Dst Port: 51974, Seq: 1, Ack: 593, Len: 240
    Source Port: 80
    Destination Port: 51974
    [Stream index: 12]
    [TCP Segment Len: 240]
    Sequence number: 1    (relative sequence number)
    [Next sequence number: 241    (relative sequence number)]
    Acknowledgment number: 593    (relative ack number)
    0101 .... = Header Length: 20 bytes (5)
    Flags: 0x018 (PSH, ACK)
        000. .... .... = Reserved: Not set
        ...0 .... .... = Nonce: Not set
        .... 0... .... = Congestion Window Reduced (CWR): Not set
        .... .0.. .... = ECN-Echo: Not set
        .... ..0. .... = Urgent: Not set
        .... ...1 .... = Acknowledgment: Set
        .... .... 1... = Push: Set
        .... .... .0.. = Reset: Not set
        .... .... ..0. = Syn: Not set
        .... .... ...0 = Fin: Not set
        [TCP Flags: ·······AP···]
    Window size value: 238
    [Calculated window size: 30464]
    [Window size scaling factor: 128]
    Checksum: 0xf04e [unverified]
    [Checksum Status: Unverified]
    Urgent pointer: 0
    [SEQ/ACK analysis]
        [iRTT: 0.202892000 seconds]
        [Bytes in flight: 240]
        [Bytes sent since last PSH flag: 240]
    [Timestamps]
        [Time since first frame in this TCP stream: 0.364705000 seconds]
        [Time since previous frame in this TCP stream: 0.005347000 seconds]
    TCP payload (240 bytes)
Hypertext Transfer Protocol
    HTTP/1.1 304 Not Modified\r\n
    Date: Sat, 19 Oct 2019 08:47:45 GMT\r\n
    Server: Apache/2.4.6 (CentOS) OpenSSL/1.0.2k-fips PHP/5.4.16 mod_perl/2.0.10 Perl/v5.16.3\r\n
    Connection: Keep-Alive\r\n
    Keep-Alive: timeout=5, max=100\r\n
    ETag: "2ca-5953d25d1970b"\r\n
    \r\n
    [HTTP response 1/2]
    [Time since request: 0.160402000 seconds]
    [Request in frame: 1078]
    [Next request in frame: 1082]
    [Next response in frame: 1083]
    [Request URI: http://gaia.cs.umass.edu/wireshark-labs/HTTP-wireshark-file4.html]

No.     Time           Source                Destination           Protocol Length Info
   1082 494.334222     172.20.10.3           128.119.245.12        HTTP     515    GET /favicon.ico HTTP/1.1 

Frame 1082: 515 bytes on wire (4120 bits), 515 bytes captured (4120 bits) on interface 0
    Interface id: 0 (\Device\NPF_{0EFDA7CA-9D7C-4454-837D-8FCD810B1695})
        Interface name: \Device\NPF_{0EFDA7CA-9D7C-4454-837D-8FCD810B1695}
        Interface description: \320\221\320\265\321\201\320\277\321\200\320\276\320\262\320\276\320\264\320\275\320\260\321\217 \321\201\320\265\321\202\321\214
    Encapsulation type: Ethernet (1)
    Arrival Time: Oct 19, 2019 11:47:46.838335000 Финляндия (лето)
    [Time shift for this packet: 0.000000000 seconds]
    Epoch Time: 1571474866.838335000 seconds
    [Time delta from previous captured frame: 0.397358000 seconds]
    [Time delta from previous displayed frame: 0.438381000 seconds]
    [Time since reference or first frame: 494.334222000 seconds]
    Frame Number: 1082
    Frame Length: 515 bytes (4120 bits)
    Capture Length: 515 bytes (4120 bits)
    [Frame is marked: False]
    [Frame is ignored: False]
    [Protocols in frame: eth:ethertype:ip:tcp:http]
    [Coloring Rule Name: HTTP]
    [Coloring Rule String: http || tcp.port == 80 || http2]
Ethernet II, Src: ChiconyE_13:e5:8f (b0:c0:90:13:e5:8f), Dst: 6a:43:7c:7b:33:64 (6a:43:7c:7b:33:64)
    Destination: 6a:43:7c:7b:33:64 (6a:43:7c:7b:33:64)
        Address: 6a:43:7c:7b:33:64 (6a:43:7c:7b:33:64)
        .... ..1. .... .... .... .... = LG bit: Locally administered address (this is NOT the factory default)
        .... ...0 .... .... .... .... = IG bit: Individual address (unicast)
    Source: ChiconyE_13:e5:8f (b0:c0:90:13:e5:8f)
        Address: ChiconyE_13:e5:8f (b0:c0:90:13:e5:8f)
        .... ..0. .... .... .... .... = LG bit: Globally unique address (factory default)
        .... ...0 .... .... .... .... = IG bit: Individual address (unicast)
    Type: IPv4 (0x0800)
Internet Protocol Version 4, Src: 172.20.10.3, Dst: 128.119.245.12
    0100 .... = Version: 4
    .... 0101 = Header Length: 20 bytes (5)
    Differentiated Services Field: 0x00 (DSCP: CS0, ECN: Not-ECT)
        0000 00.. = Differentiated Services Codepoint: Default (0)
        .... ..00 = Explicit Congestion Notification: Not ECN-Capable Transport (0)
    Total Length: 501
    Identification: 0x893c (35132)
    Flags: 0x4000, Don't fragment
        0... .... .... .... = Reserved bit: Not set
        .1.. .... .... .... = Don't fragment: Set
        ..0. .... .... .... = More fragments: Not set
        ...0 0000 0000 0000 = Fragment offset: 0
    Time to live: 128
    Protocol: TCP (6)
    Header checksum: 0x442b [validation disabled]
    [Header checksum status: Unverified]
    Source: 172.20.10.3
    Destination: 128.119.245.12
Transmission Control Protocol, Src Port: 51974, Dst Port: 80, Seq: 593, Ack: 241, Len: 461
    Source Port: 51974
    Destination Port: 80
    [Stream index: 12]
    [TCP Segment Len: 461]
    Sequence number: 593    (relative sequence number)
    [Next sequence number: 1054    (relative sequence number)]
    Acknowledgment number: 241    (relative ack number)
    0101 .... = Header Length: 20 bytes (5)
    Flags: 0x018 (PSH, ACK)
        000. .... .... = Reserved: Not set
        ...0 .... .... = Nonce: Not set
        .... 0... .... = Congestion Window Reduced (CWR): Not set
        .... .0.. .... = ECN-Echo: Not set
        .... ..0. .... = Urgent: Not set
        .... ...1 .... = Acknowledgment: Set
        .... .... 1... = Push: Set
        .... .... .0.. = Reset: Not set
        .... .... ..0. = Syn: Not set
        .... .... ...0 = Fin: Not set
        [TCP Flags: ·······AP···]
    Window size value: 513
    [Calculated window size: 131328]
    [Window size scaling factor: 256]
    Checksum: 0x276c [unverified]
    [Checksum Status: Unverified]
    Urgent pointer: 0
    [SEQ/ACK analysis]
        [iRTT: 0.202892000 seconds]
        [Bytes in flight: 461]
        [Bytes sent since last PSH flag: 461]
    [Timestamps]
        [Time since first frame in this TCP stream: 0.803086000 seconds]
        [Time since previous frame in this TCP stream: 0.397358000 seconds]
    TCP payload (461 bytes)
Hypertext Transfer Protocol
    GET /favicon.ico HTTP/1.1\r\n
    Host: gaia.cs.umass.edu\r\n
    Connection: keep-alive\r\n
    Pragma: no-cache\r\n
    Cache-Control: no-cache\r\n
    User-Agent: Mozilla/5.0 (Windows NT 10.0; Win64; x64) AppleWebKit/537.36 (KHTML, like Gecko) Chrome/77.0.3865.120 Safari/537.36\r\n
